{"id":"ACA-W002-R03","objective":"validate","requirements_basis":{"reference":"docs/requirement","proves":"basis","observed_at":"2026-08-09T00:00:00Z"},"allowed_scope":["scripts/validate-orchestration.py"],"prohibited_scope":["standard"],"risk_class":"LOW","hard_gate_triggers":["scope"],"auto_continue":false,"role_assignment":{"implementation_model":"x","implementation_reasoning":"x","audit_model":"x","audit_reasoning":"x"},"repository":"landco-llc/agentic-change-audit","branch":"feat/aca-w002","base_sha":"aaaaaaaaaaaaaaaaaaaaaaaaaaaaaaaaaaaaaaaa","target_applicable":true,"target_sha":"bbbbbbbbbbbbbbbbbbbbbbbbbbbbbbbbbbbbbbbb","pr_applicable":true,"pr_number":20,"expected_checks":["test"],"evidence":[{"reference":"docs/evidence","proves":"evidence","observed_at":"2026-08-09T00:00:00Z"}],"completion_criteria":["done"],"next_work_rule":"none","state":"AUDITING","state_history":[{"work_id":"ACA-W002-R03","recorded_at":"2026-08-09T00:00:00Z","actor_role":"CONTROLLER","repository":"landco-llc/agentic-change-audit","branch":"feat/aca-w002","base_sha":"aaaaaaaaaaaaaaaaaaaaaaaaaaaaaaaaaaaaaaaa","target_applicable":true,"target_sha":"bbbbbbbbbbbbbbbbbbbbbbbbbbbbbbbbbbbbbbbb","pr_applicable":true,"pr_number":20,"from_state":"IMPLEMENTED_DRAFT_PR","to_state":"AUDITING","reason":"draft","evidence_refs":[{"reference":"docs/evidence","proves":"evidence","observed_at":"2026-08-09T00:00:00Z"}],"evidence_hashes":["cccccccccccccccccccccccccccccccccccccccccccccccccccccccccccccccc"],"next_permitted_action":"audit"}]}
