{"id":"ACA-W002-R01","objective":"validate","requirements_basis":{"reference":"docs/requirement","proves":"basis","observed_at":"2026-08-09T00:00:00Z"},"allowed_scope":["scripts/validate-orchestration.py"],"prohibited_scope":["standard"],"risk_class":"LOW","hard_gate_triggers":["scope"],"auto_continue":false,"role_assignment":{"implementation_model":"x","implementation_reasoning":"x","audit_model":"x","audit_reasoning":"x"},"repository":"landco-llc/agentic-change-audit","branch":"feat/aca-w002","base_sha":"aaaaaaaaaaaaaaaaaaaaaaaaaaaaaaaaaaaaaaaa","target_applicable":false,"pr_applicable":false,"expected_checks":["test"],"evidence":[{"reference":"docs/evidence","proves":"evidence","observed_at":"2026-08-09T00:00:00Z"}],"completion_criteria":["done"],"next_work_rule":"none","state":"PREFLIGHT","state_history":[{"work_id":"ACA-W002-R01","recorded_at":"2026-08-09T00:00:00Z","actor_role":"CONTROLLER","repository":"landco-llc/agentic-change-audit","branch":"feat/aca-w002","base_sha":"aaaaaaaaaaaaaaaaaaaaaaaaaaaaaaaaaaaaaaaa","target_applicable":false,"pr_applicable":false,"from_state":"PLANNED","to_state":"PREFLIGHT","reason":"start","evidence_refs":[{"reference":"docs/evidence","proves":"evidence","observed_at":"2026-08-09T00:00:00Z"}],"evidence_hashes":["cccccccccccccccccccccccccccccccccccccccccccccccccccccccccccccccc"],"next_permitted_action":"implement"}]}
