{"id":"ACA-W002-R04","objective":"validate","requirements_basis":{"reference":"docs/requirement","proves":"basis","observed_at":"2026-08-09T00:00:00Z"},"allowed_scope":["scripts/validate-orchestration.py"],"prohibited_scope":["standard"],"risk_class":"LOW","hard_gate_triggers":["scope"],"auto_continue":false,"role_assignment":{"implementation_model":"x","implementation_reasoning":"x","audit_model":"x","audit_reasoning":"x"},"repository":"landco-llc/agentic-change-audit","branch":"feat/aca-w002","base_sha":"aaaaaaaaaaaaaaaaaaaaaaaaaaaaaaaaaaaaaaaa","target_applicable":true,"target_sha":"bbbbbbbbbbbbbbbbbbbbbbbbbbbbbbbbbbbbbbbb","pr_applicable":false,"expected_checks":["test"],"evidence":[{"reference":"docs/evidence","proves":"evidence","observed_at":"2026-08-09T00:00:00Z"}],"completion_criteria":["done"],"next_work_rule":"none","state":"REAUDITING","state_history":[{"work_id":"ACA-W002-R04","recorded_at":"2026-08-09T00:00:00Z","actor_role":"CORRECTION","repository":"landco-llc/agentic-change-audit","branch":"feat/aca-w002","base_sha":"aaaaaaaaaaaaaaaaaaaaaaaaaaaaaaaaaaaaaaaa","target_applicable":true,"target_sha":"bbbbbbbbbbbbbbbbbbbbbbbbbbbbbbbbbbbbbbbb","pr_applicable":false,"from_state":"CHANGES_REQUESTED","to_state":"CORRECTING","reason":"fix","evidence_refs":[{"reference":"docs/evidence","proves":"evidence","observed_at":"2026-08-09T00:00:00Z"}],"evidence_hashes":["cccccccccccccccccccccccccccccccccccccccccccccccccccccccccccccccc"],"next_permitted_action":"correct","correction_cycle":1},{"work_id":"ACA-W002-R04","recorded_at":"2026-08-09T00:01:00Z","actor_role":"CORRECTION","repository":"landco-llc/agentic-change-audit","branch":"feat/aca-w002","base_sha":"aaaaaaaaaaaaaaaaaaaaaaaaaaaaaaaaaaaaaaaa","target_applicable":true,"target_sha":"bbbbbbbbbbbbbbbbbbbbbbbbbbbbbbbbbbbbbbbb","pr_applicable":false,"from_state":"CORRECTING","to_state":"REAUDITING","reason":"fix done","evidence_refs":[{"reference":"docs/evidence","proves":"evidence","observed_at":"2026-08-09T00:00:00Z"}],"evidence_hashes":["cccccccccccccccccccccccccccccccccccccccccccccccccccccccccccccccc"],"next_permitted_action":"audit"}]}
